{
  "schema_version": "1.1",
  "project_id": "proj_customer_support_ai",
  "name": "Customer Support AI Assistant",
  "description": "Customer-facing support assistant with LLM routing and vector retrieval.",
  "owner_team": "digital-platform-ai",
  "business_criticality": "high",
  "external_exposure": "customer_facing",
  "ai_enabled": true,
  "created_at": "2026-02-21T10:30:00-06:00",
  "updated_at": "2026-02-21T10:30:00-06:00",
  "traceability": {
    "trace_id": "trc_proj_create_001",
    "source_refs": [
      "api:/projects"
    ]
  }
}
