{
  "schema_version": "1.1",
  "project_id": "proj_customer_support_ai",
  "name": "Customer Support AI Assistant",
  "description": "Customer-facing support assistant with LLM routing and vector retrieval.",
  "owner_team": "digital-platform-ai",
  "business_criticality": "high",
  "external_exposure": "customer_facing",
  "ai_enabled": true
}
